{
  "schema_version": "1.0",
  "source_sha256": "651f678e269b2a15efe2409cd6378d36b3afc7a4e96fd62b00e82046639ddab0",
  "evidence_sha256": "6ce8cbdb14f8474551724cfcc0331c664fc56c59b00d4a0f738542c5e9a663d3",
  "page": 1,
  "scope": "full_page",
  "crop_bbox_pt": [
    0,
    0,
    200.0,
    150.0
  ],
  "calibration": [
    {
      "p1_pt": [
        0,
        0
      ],
      "p2_pt": [
        100,
        0
      ],
      "distance_mm": 1000,
      "evidence": "Synthetic horizontal reference, 10 mm/pt",
      "confidence": 1
    },
    {
      "p1_pt": [
        0,
        0
      ],
      "p2_pt": [
        0,
        100
      ],
      "distance_mm": 1000,
      "evidence": "Synthetic vertical reference, 10 mm/pt",
      "confidence": 1
    }
  ],
  "walls": [
    {
      "candidate_id": "p1-f00001-001",
      "height_class": "default",
      "evidence": "Known synthetic wall footprint",
      "confidence": 1
    },
    {
      "candidate_id": "p1-f00002-001",
      "height_class": "default",
      "evidence": "Known synthetic wall footprint",
      "confidence": 1
    },
    {
      "candidate_id": "p1-f00003-001",
      "height_class": "low",
      "evidence": "Known synthetic wall footprint",
      "confidence": 1
    }
  ],
  "unresolved": []
}
